reviewId,userName,content,score,thumbsUpCount,reviewCreatedVersion,at,replyContent,repliedAt
ffe5e959-f15d-4e9a-9ff9-e1141cc81be1,A Google user,"It was good for a while, after about a month of using it I got prompted to join a subscription plan for some added features I wouldn't use. Prompted every single time I launched the app, sometimes going back to it after my phone locks and sometimes even when navigating on the screen. Truckerpath just called me three times in a row. Didn't reject the call but they called three times until I answered. I was trying to take a nap. Im thinking of removing this software.",1,19,3.9.6,2020-04-14 15:26:24,No Reply,
fae04590-e788-4500-b1fc-953aff7b626d,Randy Gallant,"Good job turning what was my go-to routing app for many years into a useless p.o.s. What a joke. Searching place names and routing to them is now nearly impossible. The map screen is filled with useless junk nobody is interested in and has zero routing functionality now. Goodbye Truckers Path. You were a great app, once; too bad you felt the need to fix what wasn't broken. Want to make money so bad, Trucker Path? Ditch this garbage version and bring back the old app for a nominal fee.",1,19,4.0.3,2020-04-28 08:45:31,"Hi Randy, we understand how annoying that must be. The ads from various companies help us to continuously provide and maintain quality content. We offer premium features at a reasonable price with our monthly subscription. We recommend that you take the trial then decide if the membership is helpful for you.",2020-04-29 14:19:59
3e783778-0469-417a-b264-a75a1cc6c6e0,Robert Dall,"This is your worst update ever. After trying to find a certain brand of TS. Can't figure out how to shut the filter off. So I can see all icons. The version with the tabs to see parking availability & weigh stations open or closed. Was by far the best version you have ever released. OLD:With more & more truckstops offering both paid & free parking. A 4th choice for parking is needed. ""only paid spaces left""",1,19,5.2.1,2021-09-13 00:09:25,"We regret to hear about your decision and apologize if you don't have access to premium features. Please provide us with your username so we can verify the current state of your account. For immediate assistance, you may call us at 7579417806 or email support@truckerpath.com. Our support team is available 24/7 to assist. Have a great day!",2019-02-04 12:06:38
8e550ece-b447-4bfc-88ed-14e02636df41,A Google user,"This app used great. Keyword ""Used"" to be. This app used to tell you current weigh station statuses and parking statuses. Now we have to unlock them by paying for a monthly subscription. Newsflash this isn't the only app out there that tells how much parking is readily available or if a weigh station is open. There are other options where they won't bombard you with popup ads, and they most definitely will not charge you for useful information. To me paying for a subscription isn't worth it.",1,19,3.8.2,2020-02-17 00:48:58,No Reply,
97782ad8-8a5f-4ea1-84cb-f42c59995b2a,A Google user,"Used to be a great app, but all great things must come to an end. As always greed has taken over and now the app is nearly unbearable with ad spam, which is incredibly disappointing as this used to be the app you'd pull up real quick to check for a quick restroom stop while rolling... That's no longer a safe option as you have to click through 3 very small X's on ads everytime you open the app. Id recommend searching for an app hosting website and downloading an older version of this app.",1,19,3.8.6,2020-02-07 15:40:02,No Reply,
39eb5d8a-ffcd-46c1-b674-8a9e84f71093,Robert,"The only reason I use this app is for the truck entries which are fairly accurate. The navigation is TERRIBLE! And dangerous! I have to constantly clear the trip, re-enter the route and start all over again, because the app stops tracking the current miles and gets stuck. The user experience is also very unfriendly. Having to go into the itinerary to make changes is very cumbersome. Why not be able to long press on a stop to delete it? Too dangerous for a Commercial driver to fumble around with!",1,19,5.4.2,2022-04-13 13:02:38,"**Hi dear user,**

Thank you for your patience. We're sorry for any inconvenience our app may have caused. Our Dev/Tech Team has resolved this issue.

Please let us know if you need any further assistance. Have a nice day!

Haul Proud, Haul Safe!",2022-06-06 06:47:51
542e77ae-69c1-4483-a45f-ff779190ca5d,whydoneed this,this app has become awefull takes too long to load many error screens on availability and details. Update... This app has gone from aweful to highly frustrating... No longer useful for just getting a quick list of truck stops along a route. Have to constantly fight off the pop-ups for premium services and trials...stop it...I just need some fast information... If you are on a slow data connection...this app will not even work tho other apps will... I will be unistalling and using another.,1,19,5.4.2,2022-03-14 11:07:03,That doesn't sound right! Can you give us more information at support@truckerpath.com so that we can investigate.,2022-03-21 17:06:34
0c9a74ae-7aa1-4c15-8ea1-5caa9a591a4e,Kowalski Patterson,"This app works when it wants. Steadily trying to take me down dirt roads or even better showing me an unrestricted truck route and still tries to route that way. More times than none it puts me in residential areas because the place where I'm going is on the other side a fence. Its always rerouting me, telling me to turn left or right when I'm clearly on the interstate. The best one is when it waits until the last second to tell me my turn is coming up.",1,19,4.1.7,2020-08-21 10:11:42,"Hello Kowalski, we apologize for the trouble you've experienced. We’d like to know the details of the problem you mentioned. Please send the details or screenshot to support@truckerpath.com. We'll pass it along to our development team and see if there is any way we can improve it.",2020-08-21 12:06:36
e395829a-6687-49cc-8373-a6a1a7d018a0,A Google user,your update sucks. more like a downgrade. I use to love this app. now everytime I exit the app. I have to put the zip code all over again. it also keeps saying location cant be found. if you guys can fix this I'll keep the app. I'll be looking for a new trucker app for now.,1,18,3.4.3,2019-03-24 06:36:41,No Reply,
0d4d5c94-9b7a-46cf-9da3-fc3c6e67b0f3,A Google user,"i am not sure what u guys did to this app, i mean, it was always glitchy but now its absolutely worthless! Takes a lifetime to load, always says error happened, parkinglots are now covered with gray lines making it impossible to see if a big truck can navigate the stupid concrete islands, half the time it says no route found at all....im finding a new app. pretty crazy considering i was about to upgrade to the paid version of this app. disappointing all around. complete garbage now! Deleted!",1,18,3.4.5,2019-04-05 19:24:04,"Hello, sorry to learn that you're dissatisfied with our latest release. We'll take note of your current observations and have our developers examine those sections that require improvements.  Thank you and have an excellent day.",2019-04-02 13:25:54
dec48ca7-3bd8-4f66-9ea3-abf185801acc,A Google user,"Sold out to a foreign entity, now super greedy for money and over ran with ads if you don't pay up. Have to click through 5-10 ads to get through anything. I'd consider paying a small one time fee but an ongoing subscription, you can forget about it. For an app that relies heavily on user input, quite greedy.",1,18,3.9.6,2020-03-28 13:46:05,No Reply,
ad7c92c7-579d-49cf-bd7e-387fd16c63f2,Anonymous Reviewer,"Major improvements have been made, less ads, still reliable when I need a truck stop, or to check weigh stations, or even truck GPS. Thanks for listening to your customers and removing those intrusive video ads. Still pop-ups while driving.",1,18,5.2.1,2021-09-15 17:26:17,Hello there! We are always working to add more features in the updates. Thank you for sharing your thoughts with us. Have a great day!,2021-02-05 20:56:11
a3c00764-6bfe-4aa9-b5e5-83458bced69c,jeff bassell,What happened after this most recent update? Now I can't see the mileage or time of arrival anymore. It's like it's whited out. I pay $10 a month for this application and it needs to function properly. I've uninstalled it and reinstalled it again. Running Android 12 on a Google pixel 3. Please get this figured out.,1,18,5.2.5,2021-11-11 18:34:02,"Hi Jeff, sorry for the trouble. We have encountered two issues with the latest Android 12 version. Do you see this white screen when changing to night mode too? If yes, kindly kill the app and try setting it up again. We are aiming to include a fix on this issue in the 5.3.0 release. Send us an email at suppprt@truckerpath.com for additional help.",2021-11-15 22:37:01
e073a43a-6d5b-4c72-8e0d-dfeae353512e,A Google user,I don't like the new update that has happened to Truckers path. I don't care for the extra small words or numbers should I say when your trying to see how far a destanation is from your location... Or when you try and look fartherel down the road how it always forces the app back the the location you at at that moment.. I would like to have the option of going back to the older version. Or Im booting the app and Ill just get a new truck stop book.. Sad because the older Truckers Path was so much.,1,17,3.5.7,2019-08-07 23:34:51,"Hi Eula, have you tried the latest update (3.6.0)? It seems to fix the issue for many of our users. Be sure to update to the latest version and re-login. Let our customer care team know at (757) 941-7806 if you continue to face problems.",2019-08-09 11:33:00
14fc7639-6b6b-484c-9f3c-7ca77b97723a,A Google user,"Well I've been using this app for a long time and gave positive * in the past but now you have gotten greedy like so many others before you. $50-$200 a month from us is just beyond the ridiculous. Full page ad takeover will get you deleted quickly in this industry, as when we need quick results in a pinch we don't need to be distracted by full screen ad takeover.. there are entirely too many apps out there to fulfill our needs to put up with your arrogance and greed.. farewell 🤔",1,17,3.8.8,2020-02-16 14:44:31,No Reply,
a022fee5-df9f-48f9-9b1a-b5c3b2e60060,A Google user,"Used to be a great app. Now, you can't even plan a route to see what there is for parking along the way. I'll never buy your routing, as I already have a truck GPS. C-YA !!! 4/18/20 ""No internet connection"" error every time I try to look at a trip.",1,17,4.0.1,2020-04-18 23:20:46,No Reply,
8bb9b9c4-ced7-46c5-926f-af0e0b1b87ad,A Google user,"you still haven't fixed this update. you obviously don't hear us. Not Trucker friendly! 1)glitchy, freezes & unexpectedly quits. 2) deep blue path is nice, however you can't see the traffic unless zoom all the way to see a sliver of red for traffic. 3) the blue dot(you on the map) literally goes off the screen as you progress on road. 4) UI is clunky. u hv 2 go 2 bottom arrow to get 2 other screen, then hit top L arrow 2 reroute. 5) get a call and then route dissapears. ugh! Sidney:)",1,17,3.4.3,2019-05-14 23:40:17,"Hello Sidney, sorry to learn that you're dissatisfied with our latest release. We appreciate your honest and constructive feedback. We'll ensure that our developers are informed of the minute details you've observed. Your continuous support will be highly appreciated. Thanks and have a great day.",2019-03-28 11:11:36
5c1924c8-ef53-4404-acd8-32ebded987c4,A Google user,"Update: I posted this review and they responded telling me to do the free trial and see if it was for me.... Point proven! It's an ok app, until the last few weeks I enjoyed it but now they went from banner ads to full screen ads that you can't skip! In the last 3 years this app has been pushing more and more for you to get the paid version and becoming more aggravating to use over time for the free version. Hell playstore rates it as #3 highest grossing app so that should tell you something...",1,17,3.8.3,2020-01-20 13:39:24,Thank you for posting a review and we’re sorry to hear that your experience was not of the quality you expected. The ads from various companies help us to continuously provide and maintain quality content. We'd recommend that you take the trial then decide if the membership will be beneficial for you. Your continued support is highly appreciated.,2020-01-20 12:43:45
fc4d8dc9-6ef8-4931-bbcd-fcc659484f9f,Dave Gallant,"I had trouble earlier. It wouldn't load if scales are open or closed or how populated truck stops where. They replied telling me that they fixed it and to download the newest update. But guess what, there is no new update. This app used to work just fine but is becoming garbage very quickly.",1,17,4.1.4,2020-07-22 13:41:42,"Hi Dave, sorry for this inconvenience. We have fixed the issue. Please update to the latest version on the Play Store.",2020-07-22 07:33:23
7ed403a0-9324-4a08-9ddd-1595ebe65fdb,A Google user,I agree with all the recent reviews. Didn't feel compelled to write one myself until a couple days ago when the pop ups became so intrusive that it cuts off any audio I'm listening to and forces me to clear out back to back pop ups while I'm in the middle of getting information on a truck stop. Too bad this used to be a great app. Been using it daily for several years. Guess I have to go find a new one.,1,17,3.8.8,2020-04-10 11:01:49,"Hi Patty, sorry to hear if you feel this way. These companies support us with the cost involved in maintaining our app. We offer a premium membership that removes the advertisements, offers optimized truck routing and even parking plus weigh station prediction. We recommend that you get the trial so you can experience the difference.",2020-04-10 16:16:30
d258b042-3d2e-4212-a051-ec8279e323b4,tikibomber,"It does not give very accurate directions, and refuses to follow construction cone set up that is not trucker friendly. The app also has a weird habit of randomly closing down in the middle of navigating. The map tends to lag in non-cellular locations and passes. Just called them. The receiver is more dense than a boat on water. Dropped ratings from 3 to 1 star because of this.",1,17,4.3.8,2021-02-19 23:06:27,"Hi there, we apologize if you were unable to get proper routing. We would like the opportunity to investigate your feedback further. Please contact us at support@truckerpath.com or call our customer care team at (757) 941-7806. We’ll work with you to resolve any issues as quickly as possible.",2021-02-19 17:24:21
54906c62-d9ef-4ffe-ab73-aac8eb11a686,A Google user,"You people have screwed up this app. I have used it many times in the past, but now, since the update, I'm swamped with advertisements galore. Then i am asked constantly, if I would like to PAY to block advertisements, plus the games that someone wants me to download. I am EXTREMELY DISAPPOINTED. It was great, but now pretty much useless. I'm searching for a better app.",1,17,3.9.6,2020-04-09 00:14:40,"Hi there, we are sorry for the increased number of ads lately. Ads are inserted to generate revenue so we can continue providing our users with quality content. We recommend that you take the trial so you can get rid of unwanted ads and will allow you to experience exclusive features. Thanks for your understanding.",2020-04-09 16:28:31
d77dc298-b138-4b53-b223-e66895ce2942,A Google user,"Utterly useless now, all we needed is to know what parking is like and exactly what truck stops are in between, I can't even search a route, like seriously I can't search it all, it's just brings me to a page for the gold package, going to try once or twice more but if I still can't search the route, deleting",1,17,3.9.2,2020-03-12 06:39:21,No Reply,
ddcfc293-60fd-4d8a-9e65-24381d9997a7,A Google user,"Honestly I liked the older version. I understand you have to pay the bills but the pop ups that you can't bypass are annoying as f***! map screen drifts as you try to tap on stops and the stops are so stacked on top each other you can't differentiate... also annoying as f***! If I pull up the app it's because I need it, I don't want to take a mandatory survey while driving down the road before I can see if the scale 2 miles away is open.. App has become more trouble than help..",1,17,3.5.7,2019-07-29 02:58:57,"Hi Mark, we sincerely apologize for the troubles you've had with the app. We understand how annoying that must be and we are working towards making this better. Your continued support is highly appreciated.",2019-07-29 12:30:57
79db796d-74f5-41e2-8571-066e8e36dd8d,Jason Jensen,"Needs a lot of work. If you are looking for a navigation app that is buggy, will force close while navigating, and route you to the wrong location; then you've found your app. Install for a frustrating and confusing experience.",1,17,5.2.3,2021-10-10 07:42:17,Thanks for your feedback. We’d like to know the details of the problem you mentioned. Please send the details or screenshot to support@truckerpath.com. We'll pass it along to our development team and see if there is any way we can improve it.,2021-10-11 20:01:17
bc3e5cd2-d1b2-4c0c-9040-bf2acc47dda0,Jeremy Milligan,"I think this app might be hacked, or something like that. I signed up for premium trial for truck routing and 4 days before I was supposed to be charged the app tried to charge $162 to my credit card through Google. Luckily my bank flagged it and I was able to deny the charge. Needless to say I will not be continuing my premium subscription.",1,17,5.3.8,2022-02-24 19:12:31,"Hi Jeremy, Oh no! We sincerely apologize for the troubles you've had with the app. We'd be happy to take a look into this for you, please contact us at support@truckerpath.com. Thank you.",2022-03-01 21:34:51
b491eead-f9dc-4e24-9d42-7ea2d2db67f0,A Google user,since the last few updates this app is completly horrable. takes entirly to many steps to change destanation when you are able to get to the correct area the app kicks user out. also the app seems to freeze. please go back to the older version you had a few months ago. i could do without the fourms and job finders. do you even listen to your coustomers...everyone is and has been complaning about the same issues but nothing is getting done about it...i find your generic responses rediclous,1,17,3.4.5,2019-04-03 12:02:35,"Hello Rachael, we're sorry about your recent experience. There are primary reasons why we need to perform regular updates such as bug fixes, system patches, new features and performance improvement among others. We'll take note of your observations and we'll ensure to check these areas. Thanks for providing an honest review and have a great day.",2019-04-03 11:40:16
01fcdd5a-2185-4b45-a75a-1a0ecfdfce1e,Abel Rivera,"#SMH Not worth $30 a month but very useful app, I started using this years ago and it has always been a really good resource i can't put enough on that, but as far as navigation gose its horrible, it constantly stops, it wants me to do u turns in the middle of my trip or if you add stops for your break it won't continue, they need to go back to the drawing board with this..... i think everyone with a cdl should have this app and i wish the navigation worked but till then its 2 stars for me",1,16,4.1.2,2020-07-01 02:17:03,"Hey Abel, Frank from the development team here. Can you send me an email to support@truckerpath.com? I'd love to look into your case and try to fix navigation problems you're facing, and hear any other suggestions/feedback you have!",2020-06-24 10:08:58
e638daf8-94bd-479c-b07b-fabaddff91c5,Anthony Chapman,I pay to use the app not too big of a deal however I'm getting quite frustrated with the fact I'll be driving down the highway and out of nowhere the app will minimize down into a picture in picture view and take me to my home screen on my phone. Sometimes it does it over and over again and sometimes it does it once an hour either way it always manages to do it at the worst possible time,1,16,6.3.7,2024-07-25 14:15:02,"Thank you for raising this concern, Anthony. This seems to be an issue with your device and how it works with your app. Please reach us at support@truckerpath.com so we can further look into this and come up with a fix. Thank you.",2024-07-29 13:05:14
7225af21-ccc2-4516-bf30-52b221f7341e,Mech Mobile,"This app went from usable to worthless. Who told you programmers without CDL that doing this last update was a good idea? When turning on a filter (ex. Truck stops, scales) and panning around to the right one, the GPS pinpoint to take me back to my location is gone. No amount of zooming in or out fixes it unless we go back to general layout without filters. When clicking on a truck stop or rest areas I pass by, now get a worthless list. Ugh. Done! Time to uninstall",1,16,5.6.6,2022-11-01 15:52:23,"We apologize for the inconvenience. Software updates are essential because they include enhanced features with different applications. They can also improve the stability of your software, and remove outdated features. Please feel free to reach out to our support team at (757) 941-7806 with any further comments, or suggestions. Thank you.",2022-11-01 21:39:47
c82ac084-2edb-4311-bcf1-56cea99aeaad,A Google user,"This app was great. Now its infected with greed and popup ads. Right when it's most inconvenient. Its sickens me to see the greed of others. Perfect example I turn the app on it starts to populate then boom an ad. I close the ad and boom another from trucker path. And just to make sure I'm serious it asks if I want to buy premium. Seriously you greedy people. I hope truckers stop updating stations parking and anything else that drives your app to success. Because without us, your app is useless.",1,16,3.9.6,2020-04-07 11:29:27,No Reply,
01c7ca07-eb38-49da-8a55-0ae75f2f12b1,A Google user,"Refund me my money now!!Very shady business. I signed up for a free trial of the paid service, wasnt worth it to me so I got in the app to cancel the service before the auto renewal. No place at all on the app to cancel the service. I call, on hold for over 30 minutes and the gentleman said it was taken care of and the service was cancelled. next day I get a $299 charge on my card so now I'm waiting on hold again to try to get this refunded. STAY FAR AWAY FROM THIS SHADY APP",1,16,4.0.1,2020-04-18 00:47:05,No Reply,
349b91c2-a4b6-4594-ad3e-fc294db3f43d,A Google user,"As a truck driver I was pretty excited.  I downloaded the app and was impressed with some of the features,  but then,  I tried to figure out how to use the navigation system. That's when I started realizing that this was not the app for me or anyone else for that matter.  The GPS doesn't actually give you turn by turn navigating and when you type in your location a system message reads that this app is NOT designed for truck routes!!!?   WTH. THE WHOLE APP IS DESIGNED FOR TRUCKS!! Waisted my time.  Thanks!",1,16,1.78.0,2016-12-18 22:22:59,Hi Mike. Thanks for your feedback. We are sorry about your frustration. Truck-optimized routing is coming soon with a new update. We hope you enjoy the improved feature. Have a wonderful day!,2016-12-19 14:36:32
caa21964-0fbc-48d4-b25b-183863d0a960,Andrii Biletskyi,"This app is very raw for Truck drivers. For one week of use I got THREE wrong location. I reported about one. Then next week again almost the same. When I reported, they want me to describe in detail"" where it's happened, what Hwy I use.. "" and I feel like Its part time job. They have to pay me for wrong address report, but they charge me every month $10.86 instead. I have no time to fix all of that.",1,16,5.0.1,2021-05-19 17:21:00,"Sorry to know you had a terrible experience with our app's navigation. We'd love to look further into this, if you can share some more details please about your misrouted trips and reach us at support@truckerpath.com. Thanks!",2021-05-19 20:56:46
6a7e8946-f654-4c8a-a3f7-33bc241a947f,A Google user,Tired of the f'in ads. You cant do anything in this app anymore without being harrassed by ads. What makes it worse is that the ads are for games and other irrelevant junk. I refuse to pay for this app. What makes the ads sadder is the tech team says it helps pay to keep the app up to date. How does free games that are essentially the same thing as this app (pay if you want) help pay for future updates? Personally this app has turned into every other play store app like this and that's junk.,1,16,3.8.4,2020-01-23 17:34:04,No Reply,
66b6f469-746b-4f60-b6f4-cd104241499c,A Google user,"This used to be the best app for truckers out there. We were local drivers and haven't needed it in about a year. Now I can't even find truck stops because the app won't load the map until it loads a full screen ad. Satellite views are gone, so now you need to switch back and forth between Google maps and Trucker Path to see what the parking area looks like, or how tight it is. They're asking for entirely too much money for what is essentially an ad blocker on a crowd sourcing app.",1,16,3.9.2,2020-03-19 16:21:38,No Reply,
88a3e478-fada-4919-953e-21df46b8b43e,A Google user,Quit using the app because the level of pop-up ads is ridiculous. Open the app to a pop-up. Close the pop-up to find a second pop-up. Two banner ads on the screen. Click anything get another pop-up. Monthly fee to go ad free is too expensive because of all the extra garbage services you're tacking on to pad the bill. No thanks.,1,15,3.9.6,2020-04-06 14:22:00,No Reply,
